{"schema_version":"1.0.0","record_kind":"HUMAN_AUTHORIZATION_DECISION_EVENT_V1","decision_event_id":"hde-0123456789abcdef0123456789abcdef","reservation_id":"har-0123456789abcdef0123456789abcdef","reservation_sha256":"sha256:daa699ae713512ad3e357c9bc9720714024d6dbb1afde0f81e9d7ac3cadb7d78","action":"PREFERENCE_PROMOTE","decision":"AUDIT_ONLY","occurred_at":"2026-09-05T00:01:00Z","authority_created":false,"effect_performed":false,"native_user_presence_verified":false}
